<?xml version="1.0" encoding="UTF-8"?>
<!DOCTYPE book SYSTEM "triggers.dtd">
<book>
	<name>Continual Service Improvement</name>

	<process>
		<name>Continual Service Improvement Processes</name>
		<trigger page="64">Ongoing processes:<trigger page="64"><class type="periodic">Probably periodic triggers</class></trigger><trigger page="64"><class type="observation">Probably observations by continual service improvement staff</class></trigger></trigger>
		<trigger page="64"><class type="decision">New incentives</class></trigger>
		<trigger page="64"><class type="decision">Changing business requirements</class>
			<tex>\\ $\rightarrow$</tex> Highly probable due to decision to accept / for awareness of changed requirements</trigger>
		<trigger page="64">Poor performance or spiralling costs:<trigger page="64"><class type="speechact"><force name="Complain"><assertive/><directive/><expressive/></force>Complaint</class></trigger><trigger page="64"><class type="artifact">Automatically gathered information</class></trigger></trigger>
	</process>
</book>
